{"$id":"urn:hioc:pe4:association-contract:1.0","$schema":"https://json-schema.org/draft/2020-12/schema","additionalProperties":false,"properties":{"association_outcomes":{"const":["ASSOCIATED_STRONG_MAC","REVIEW_ONLY_NO_MAC","REVIEW_ONLY_MULTIPLE_MAC","REJECT_INVALID_MAC","REJECT_HA_MAC_COLLISION","REJECT_HIOC_MAC_AMBIGUITY","REJECT_PRIOR_BINDING_CONFLICT","UNMATCHED_STRONG_EVIDENCE","ENTITY_WITHOUT_DEVICE_IDENTITY","REJECT_STRUCTURAL_CONTRACT"]},"authority":{"const":{"asset_fields_never_overwritten":["friendly_name","physical_location","purpose","notes","owner","criticality","expected_availability"],"configuration_url":"NOT_RETAINED_NOT_PARSED_NOT_LOGGED_NOT_PUBLISHED","disabled":"METADATA_ONLY_NOT_OFFLINE_NOT_IDENTITY_INVALIDATION","ha":"OWN_REGISTRY_METADATA_ONLY","ha_hostname_identity_extraction":"NOT_AUTHORIZED","ha_ip_identity_extraction":"NOT_AUTHORIZED","hioc":["STABLE_DEVICE_ID","CANONICAL_MAC","CANONICAL_IP","PASSIVE_OBSERVATION","LIVENESS","HEALTH","INCIDENTS","EXPECTED_AVAILABILITY"],"metadata_is_identity":false,"precedence":["OPERATOR_ASSET_METADATA","HIOC_CANONICAL_FIELD_AUTHORITY","GOVERNED_MANUFACTURER_ENRICHMENT","HA_SOURCE_SPECIFIC_SUPPORTING_METADATA"],"serial_number":"NOT_RETAINED_NOT_IDENTITY","via_device_id":"PRIVATE_FUTURE_HA_TOPOLOGY_CANDIDATE_ONLY_NO_NETWORK_PARENT_REWRITE"}},"automatic_association_basis":{"const":"UNIQUE_VALID_NONCOLLIDING_MAC"},"baseline_commit":{"const":"d7aa423e2ead6e9c1266a884ab3e25e4331ebec1"},"changes_asset_fields":{"const":false},"changes_health":{"const":false},"changes_hioc_canonical_ip":{"const":false},"changes_hioc_mac":{"const":false},"changes_hioc_stable_id":{"const":false},"changes_incidents":{"const":false},"changes_liveness":{"const":false},"core_source_baseline":{"const":"2026.8.1"},"creates_hioc_identity":{"const":false},"entity_membership":{"const":{"independent_matching":false,"many_entities_per_strong_device":true,"path":"entity.device_id -> strongly associated HA device -> HIOC device","template_scene_group_automation":"NEVER_CREATE_IDENTITY_PE8_FUTURE","unique_id_retention":"NOT_RETAINED","without_device":"ENTITY_WITHOUT_DEVICE_IDENTITY"}},"evidence_basis":{"const":"OPERATOR_SUPPLIED_SANITIZED_PRODUCTION_EVIDENCE"},"failed_capability":{"const":null},"generic_integration_inventory_ingestion":{"const":"PROHIBITED"},"ha_role":{"const":"ASSOCIATION_METADATA_SOURCE"},"identity_engine":{"const":"HIOC_ONLY"},"lifecycle_state":{"const":"PASS_CLOSED"},"likely_update_compatibility_break":{"const":false},"mac_rules":{"const":{"cardinality":"ONE_HA_DEVICE_TO_ONE_EXISTING_HIOC_DEVICE","collision_tiebreakers":"PROHIBITED","decision_order":"VALIDATE_COMPLETE_DEVICE_RESPONSE_AND_BUILD_GLOBAL_INDEXES_BEFORE_ASSOCIATION","distinct_valid_mac_count":1,"duplicate_entries":"DEDUPLICATE_VALID_NORMALIZED_MACS_WITHOUT_REPAIRING_INVALID_VALUES","global_indexes_required":["NORMALIZED_MACS_BY_HA_DEVICE","HA_DEVICES_BY_NORMALIZED_MAC","INVALID_MAC_CONDITIONS","MULTIPLE_MAC_CONDITIONS","HIOC_DEVICES_BY_CANONICAL_MAC"],"ha_collision":"REJECT_HA_MAC_COLLISION","ha_device_count_per_mac":1,"hioc_ambiguity":"REJECT_HIOC_MAC_AMBIGUITY","hioc_device_count_per_mac":1,"invalid_mac":"REJECT_INVALID_MAC","merge_hioc_duplicates":false,"multiple_mac":"REVIEW_ONLY_MULTIPLE_MAC","no_mac":"REVIEW_ONLY_NO_MAC","normalization":"EXISTING_HIOC_NORMALIZE_MAC_ONLY","normalization_forms":["TRIM","LOWERCASE","HYPHEN_TO_COLON","SIX_COLON_SEPARATED_HEX_OCTETS"],"unmatched":"UNMATCHED_STRONG_EVIDENCE"}},"namespace_authority":{"const":{"connections":{"bluetooth":"SUPPORTING_PRIVATE_ONLY_NOT_NETWORK_MAC","mac":"ONLY_STRONG_NAMESPACE_SUBJECT_TO_ALL_MAC_RULES","upnp":"SUPPORTING_PRIVATE_ONLY_NO_IDENTITY_EXTRACTION"},"identifiers":{"hue":"SUPPORTING_PRIVATE_ONLY_AFTER_STRONG_ASSOCIATION","mqtt":"SUPPORTING_PRIVATE_ONLY_AFTER_STRONG_ASSOCIATION","upnp":"SUPPORTING_PRIVATE_ONLY_AFTER_STRONG_ASSOCIATION","zwave_js":"SUPPORTING_PRIVATE_ONLY_AFTER_STRONG_ASSOCIATION"},"new_authority":"EXPLICIT_FUTURE_CONTRACT_UPDATE_REQUIRED","unknown":"NO_IDENTITY_AUTHORITY_IGNORE_VALUES_AGGREGATE_COUNTS_ONLY"}},"next_checkpoint":{"const":"PE-4 Home Assistant Association Adapter Implementation Preparation"},"next_checkpoint_state":{"const":"NOT_STARTED"},"no_ha_mutation":{"const":["REGISTRY_WRITES","RENAME","AREA_CHANGES","ENTITY_CHANGES","INTEGRATION_RELOAD","MUTATION_SERVICES","CONFIGURATION","RESTART","STORAGE_WRITES","STATE_WRITES","AUTOMATION_EXECUTION"]},"observation_boundary":{"const":{"availability_future_owners":["PE7","PE10"],"count_coverage_is_one_to_one":false,"dedicated_post_identity_layer":true,"entity_presence_proves_availability":false,"generic_source_provenance_append":false,"ha_absence_reduces_hioc_confidence":false,"isolation":"HA_ASSOCIATION_ONLY_NOT_DHCP_NUT_INVENTORY_MANUFACTURER_MQTT","no_changes":["last_seen","reachable","online_offline","observation_status","monitoring_policy","health_score","health_status","availability_incidents"],"weak_ip_promotion":false}},"observed_compatibility":{"const":"COMPATIBLE_UPDATED"},"observed_ha_core_version":{"const":"2026.9.4"},"prior_binding":{"const":{"conflict":"REJECT_PRIOR_BINDING_CONFLICT","retain_previous_known_good":true,"reverse_cardinality_conflict":"REJECT_PRIOR_BINDING_CONFLICT","review_required":true,"silent_move":false}},"private_prohibited_fields":{"const":["mac","ip","hostname","unique_id","serial_number","configuration_url","config_entry_title","raw_registry_records","raw_response_bodies","unknown_fields","unknown_namespace_values","arbitrary_identifier_values","arbitrary_connection_values","credentials"]},"private_retention_allowlist":{"const":["hioc_device_id","instance_reference","ha_device_id","association_basis","status","first_associated_at","last_confirmed_at","observed_ha_version","contract_version","ha_metadata","entities","config_entries","area_candidate","relationship_status"]},"private_state_path":{"const":"state/inventory/associations/home_assistant.json"},"production_observation":{"const":{"counts_are_snapshot_only":true,"date":"2026-10-06","device_recognized_fields_present_all_records":"OBSERVATION_ONLY_NOT_FUTURE_GUARANTEE","registries":{"area_registry":{"counts":{"total":22},"recognized_fields_types":{"aliases":["array"],"area_id":["string"],"created_at":["number"],"floor_id":["null"],"humidity_entity_id":["null"],"icon":["null","string"],"labels":["array"],"modified_at":["number"],"name":["string"],"picture":["null"],"temperature_entity_id":["null"]}},"config_entry_registry":{"counts":{"disabled":1,"total":97,"unknown_field_occurrences":97},"recognized_fields_types":{"created_at":["number"],"disabled_by":["null","string"],"domain":["string"],"entry_id":["string"],"error_reason_translation_key":["null"],"error_reason_translation_placeholders":["null"],"modified_at":["number"],"num_subentries":["integer"],"pref_disable_new_entities":["boolean"],"pref_disable_polling":["boolean"],"reason":["null"],"source":["string"],"state":["string"],"supported_subentry_types":["object"],"supports_options":["boolean"],"supports_reconfigure":["boolean"],"supports_remove_device":["boolean"],"supports_unload":["boolean"],"title":["string"]}},"device_registry":{"counts":{"connection_collision_values":11,"connections_multiple":6,"connections_one":57,"connections_zero":166,"disabled":2,"identifier_collision_values":0,"mac_canonical":54,"mac_collision_values":9,"mac_conflicting_devices":18,"mac_duplicate_entries":0,"mac_entries":62,"mac_invalid":8,"mac_multiple":2,"mac_normalization_required":0,"mac_one":58,"mac_zero":169,"total":229,"unknown_field_occurrences":229,"unpublished_namespace_occurrences":177,"via_device":19,"with_area":58,"with_config_entry":229},"recognized_fields_types":{"area_id":["null","string"],"config_entries":["array"],"config_entries_subentries":["object"],"config_entry_id":["string"],"config_subentry_id":["null","string"],"configuration_url":["null","string"],"connections":["array"],"created_at":["number"],"disabled_by":["null","string"],"entry_type":["null","string"],"hw_version":["null","string"],"id":["string"],"identifiers":["array"],"labels":["array"],"manufacturer":["null","string"],"model":["null","string"],"model_id":["null","string"],"modified_at":["number"],"name":["null","string"],"name_by_user":["null","string"],"primary_config_entry":["string"],"serial_number":["null","string"],"sw_version":["null","string"],"via_device_id":["null","string"]}},"entity_registry":{"counts":{"automation_domain":61,"disabled":1042,"group_domain":0,"scene_domain":5,"template_platform":52,"total":2425,"with_area":1,"with_config_entry":2291,"with_device":2241,"without_device":184},"recognized_fields_types":{"area_id":["null","string"],"categories":["object"],"config_entry_id":["null","string"],"config_subentry_id":["null","string"],"created_at":["number"],"device_id":["null","string"],"disabled_by":["null","string"],"entity_category":["null","string"],"entity_id":["string"],"has_entity_name":["boolean"],"hidden_by":["null","string"],"icon":["null","string"],"id":["string"],"labels":["array"],"modified_at":["number"],"name":["null","string"],"options":["object"],"original_name":["null","string"],"platform":["string"],"translation_key":["null","string"],"unique_id":["string"]}}},"unknown_config_entry_field_observed_type":"null","unknown_field_names":"UNPUBLISHED_NOT_INVENTED"}},"prohibited_automatic_matching":{"const":["LEVENSHTEIN_STRING_SIMILARITY","SUBSTRING_NAME_MATCHING","MANUFACTURER_MODEL_SCORING","AREA_SCORING","ENTITY_COUNT_SCORING","INTEGRATION_DOMAIN_SCORING","WEIGHTED_CONFIDENCE_PERCENTAGES","IP_ONLY","HOSTNAME_ONLY","FRIENDLY_NAME","ENTITY_ID","UNIQUE_ID","SERIAL_NUMBER","CONFIGURATION_URL","INTEGRATION_IDENTIFIERS"]},"public_prohibited_fields":{"const":["raw_ha_mac","ha_device_id","entity_registry_id","entity_id","unique_id","config_entry_id","device_name","area_name","config_entry_title","serial_number","configuration_url","arbitrary_identifier_values","arbitrary_connection_values","private_relationship_values"]},"public_projection_allowlist":{"const":["associated","association_basis","entity_count","integration_domains","has_area_candidate"]},"record_type":{"const":"PE4_0C_ASSOCIATION_CONTRACT"},"runtime_adapter":{"const":"NOT_IMPLEMENTED"},"schema_evolution":{"const":{"additive_fields":"TOLERATE_ONLY_IF_REQUIRED_FIELDS_AND_TYPES_COMPATIBLE","observed_presence":"SNAPSHOT_ONLY_NOT_UNIVERSAL_REQUIRED_FIELDS","required_break":"FAIL_CLOSED_HA_ASSOCIATION_SUBSYSTEM","universal_future_ha_compatibility":false,"unknown_fields":"NOT_CONSUMED_NOT_RETAINED_NOT_IDENTITY_COUNT_ONLY","unknown_namespaces":"IGNORE_FOR_MATCHING_NO_AUTHORITY_UNTIL_REVIEWED","version_drift_alone":"CONTINUE_COMPATIBLE_UPDATED"}},"schema_version":{"const":"1.0"},"snapshot":{"const":{"cross_registry_atomicity":false,"dangling_reference":"NO_FABRICATED_LINK_MARK_RELATIONSHIP_METADATA_INCOMPLETE","identity_scope":"COMPLETE_DEVICE_REGISTRY_RESPONSE","incomplete_relationships":"PRESERVE_STRONG_DEVICE_ASSOCIATION","reads":"FOUR_SEQUENTIAL_APPROVED_REGISTRY_READS","relationships":"BEST_EFFORT_COMPLETED_BOUNDED_INVOCATION"}},"source_2b_closure":{"const":"governance/pe4/pe4-0b2b-execution-closure.json"},"source_2b_closure_sha256":{"const":"5041072e1dec01ddad39eecf7547a4f4387b21acb158febed0f8b7187b866571"},"source_2b_evidence_directory":{"const":"/tmp/hioc-pe4-ha-discovery-7bb82b7c"},"source_2b_report_sha256":{"const":"322e237404c3c721be782e9ce2dbc4ceb1e63b8374af00b6fe75a940624d2ded"},"source_2b_result_sha256":{"const":"685606f76aad93ede32b52c2ffa34984408d62d408185ab6141791eded478e43"},"source_structure_fingerprint":{"const":"fef567f29e545e1b7c03b4a8c585f0b03b6ea8b588c5502acb5ce51e809d9b1d"},"state_schema":{"const":"governance/pe4/pe4-home-assistant-association-state.schema.json"},"status":{"const":"FROZEN"},"strong_association_requirements":{"const":["VALID_DEVICE_STRUCTURAL_CORE","SAFE_CONNECTION_PAIR_ARRAY","MAC_NAMESPACE_PRESENT","ALL_MAC_VALUES_VALID","EXACTLY_ONE_DISTINCT_VALID_NORMALIZED_MAC","NO_INVALID_OR_AMBIGUOUS_MAC_CONDITION","UNIQUE_ACROSS_COMPLETE_HA_DEVICE_RESPONSE","EXACTLY_ONE_EXISTING_CANONICAL_MAC_BACKED_HIOC_DEVICE","NO_HIOC_CANONICAL_IDENTITY_CONFLICT","NO_PRIOR_DURABLE_BINDING_CONFLICT","NO_STABLE_ID_MAC_CANONICAL_IP_CHANGE","NO_DISCOVERY_OR_LIVENESS_AUTHORITY"]},"structural_cores":{"const":{"area":{"area_id":"string","name":"string"},"config_entry":{"domain":"string","entry_id":"string"},"device":{"connections":"array_of_exact_two_string_pairs","id":"string"},"entity":{"device_id":"null|string","entity_id":"string","id":"string","platform":"string"}}},"transactional_state":{"const":{"candidate":"BOUNDED_IN_MEMORY_FIRST","per_record_rejections":"DIAGNOSTICS_ONLY_NO_AMBIGUOUS_BINDING_NO_SILENT_PRIOR_REBIND","replace":"ATOMIC_ONLY_COMPLETELY_VALIDATED_CANDIDATE","retain_last_known_good_on":["TRANSPORT_FAILURE","AUTHENTICATION_FAILURE","SCHEMA_INCOMPATIBILITY","REQUIRED_COMMAND_FAILURE","COMPATIBILITY_FAILURE","STATE_PUBLICATION_FAILURE"],"validate_before_replace":["COMPLETE_REQUIRED_READS","COMPATIBILITY_CONTRACT","RECORD_SHAPE","MAC_PARSING","GLOBAL_HA_MAC_UNIQUENESS","HIOC_MAC_UNIQUENESS","PRIOR_BINDINGS","PRIVATE_STATE_SCHEMA","PRIVACY_PUBLIC_PROJECTION"]}}},"required":["association_outcomes","authority","automatic_association_basis","baseline_commit","changes_asset_fields","changes_health","changes_hioc_canonical_ip","changes_hioc_mac","changes_hioc_stable_id","changes_incidents","changes_liveness","core_source_baseline","creates_hioc_identity","entity_membership","evidence_basis","failed_capability","generic_integration_inventory_ingestion","ha_role","identity_engine","lifecycle_state","likely_update_compatibility_break","mac_rules","namespace_authority","next_checkpoint","next_checkpoint_state","no_ha_mutation","observation_boundary","observed_compatibility","observed_ha_core_version","prior_binding","private_prohibited_fields","private_retention_allowlist","private_state_path","production_observation","prohibited_automatic_matching","public_prohibited_fields","public_projection_allowlist","record_type","runtime_adapter","schema_evolution","schema_version","snapshot","source_2b_closure","source_2b_closure_sha256","source_2b_evidence_directory","source_2b_report_sha256","source_2b_result_sha256","source_structure_fingerprint","state_schema","status","strong_association_requirements","structural_cores","transactional_state"],"title":"Frozen PE-4.0C association contract version 1.0","type":"object"}
