{"association_outcomes":["ASSOCIATED_STRONG_MAC","REVIEW_ONLY_NO_MAC","REVIEW_ONLY_MULTIPLE_MAC","REJECT_INVALID_MAC","REJECT_HA_MAC_COLLISION","REJECT_HIOC_MAC_AMBIGUITY","REJECT_PRIOR_BINDING_CONFLICT","UNMATCHED_STRONG_EVIDENCE","ENTITY_WITHOUT_DEVICE_IDENTITY","REJECT_STRUCTURAL_CONTRACT"],"authority":{"asset_fields_never_overwritten":["friendly_name","physical_location","purpose","notes","owner","criticality","expected_availability"],"configuration_url":"NOT_RETAINED_NOT_PARSED_NOT_LOGGED_NOT_PUBLISHED","disabled":"METADATA_ONLY_NOT_OFFLINE_NOT_IDENTITY_INVALIDATION","ha":"OWN_REGISTRY_METADATA_ONLY","ha_hostname_identity_extraction":"NOT_AUTHORIZED","ha_ip_identity_extraction":"NOT_AUTHORIZED","hioc":["STABLE_DEVICE_ID","CANONICAL_MAC","CANONICAL_IP","PASSIVE_OBSERVATION","LIVENESS","HEALTH","INCIDENTS","EXPECTED_AVAILABILITY"],"metadata_is_identity":false,"precedence":["OPERATOR_ASSET_METADATA","HIOC_CANONICAL_FIELD_AUTHORITY","GOVERNED_MANUFACTURER_ENRICHMENT","HA_SOURCE_SPECIFIC_SUPPORTING_METADATA"],"serial_number":"NOT_RETAINED_NOT_IDENTITY","via_device_id":"PRIVATE_FUTURE_HA_TOPOLOGY_CANDIDATE_ONLY_NO_NETWORK_PARENT_REWRITE"},"automatic_association_basis":"UNIQUE_VALID_NONCOLLIDING_MAC","baseline_commit":"d7aa423e2ead6e9c1266a884ab3e25e4331ebec1","changes_asset_fields":false,"changes_health":false,"changes_hioc_canonical_ip":false,"changes_hioc_mac":false,"changes_hioc_stable_id":false,"changes_incidents":false,"changes_liveness":false,"core_source_baseline":"2026.8.1","creates_hioc_identity":false,"entity_membership":{"independent_matching":false,"many_entities_per_strong_device":true,"path":"entity.device_id -> strongly associated HA device -> HIOC device","template_scene_group_automation":"NEVER_CREATE_IDENTITY_PE8_FUTURE","unique_id_retention":"NOT_RETAINED","without_device":"ENTITY_WITHOUT_DEVICE_IDENTITY"},"evidence_basis":"OPERATOR_SUPPLIED_SANITIZED_PRODUCTION_EVIDENCE","failed_capability":null,"generic_integration_inventory_ingestion":"PROHIBITED","ha_role":"ASSOCIATION_METADATA_SOURCE","identity_engine":"HIOC_ONLY","lifecycle_state":"PASS_CLOSED","likely_update_compatibility_break":false,"mac_rules":{"cardinality":"ONE_HA_DEVICE_TO_ONE_EXISTING_HIOC_DEVICE","collision_tiebreakers":"PROHIBITED","decision_order":"VALIDATE_COMPLETE_DEVICE_RESPONSE_AND_BUILD_GLOBAL_INDEXES_BEFORE_ASSOCIATION","distinct_valid_mac_count":1,"duplicate_entries":"DEDUPLICATE_VALID_NORMALIZED_MACS_WITHOUT_REPAIRING_INVALID_VALUES","global_indexes_required":["NORMALIZED_MACS_BY_HA_DEVICE","HA_DEVICES_BY_NORMALIZED_MAC","INVALID_MAC_CONDITIONS","MULTIPLE_MAC_CONDITIONS","HIOC_DEVICES_BY_CANONICAL_MAC"],"ha_collision":"REJECT_HA_MAC_COLLISION","ha_device_count_per_mac":1,"hioc_ambiguity":"REJECT_HIOC_MAC_AMBIGUITY","hioc_device_count_per_mac":1,"invalid_mac":"REJECT_INVALID_MAC","merge_hioc_duplicates":false,"multiple_mac":"REVIEW_ONLY_MULTIPLE_MAC","no_mac":"REVIEW_ONLY_NO_MAC","normalization":"EXISTING_HIOC_NORMALIZE_MAC_ONLY","normalization_forms":["TRIM","LOWERCASE","HYPHEN_TO_COLON","SIX_COLON_SEPARATED_HEX_OCTETS"],"unmatched":"UNMATCHED_STRONG_EVIDENCE"},"namespace_authority":{"connections":{"bluetooth":"SUPPORTING_PRIVATE_ONLY_NOT_NETWORK_MAC","mac":"ONLY_STRONG_NAMESPACE_SUBJECT_TO_ALL_MAC_RULES","upnp":"SUPPORTING_PRIVATE_ONLY_NO_IDENTITY_EXTRACTION"},"identifiers":{"hue":"SUPPORTING_PRIVATE_ONLY_AFTER_STRONG_ASSOCIATION","mqtt":"SUPPORTING_PRIVATE_ONLY_AFTER_STRONG_ASSOCIATION","upnp":"SUPPORTING_PRIVATE_ONLY_AFTER_STRONG_ASSOCIATION","zwave_js":"SUPPORTING_PRIVATE_ONLY_AFTER_STRONG_ASSOCIATION"},"new_authority":"EXPLICIT_FUTURE_CONTRACT_UPDATE_REQUIRED","unknown":"NO_IDENTITY_AUTHORITY_IGNORE_VALUES_AGGREGATE_COUNTS_ONLY"},"next_checkpoint":"PE-4 Home Assistant Association Adapter Implementation Preparation","next_checkpoint_state":"NOT_STARTED","no_ha_mutation":["REGISTRY_WRITES","RENAME","AREA_CHANGES","ENTITY_CHANGES","INTEGRATION_RELOAD","MUTATION_SERVICES","CONFIGURATION","RESTART","STORAGE_WRITES","STATE_WRITES","AUTOMATION_EXECUTION"],"observation_boundary":{"availability_future_owners":["PE7","PE10"],"count_coverage_is_one_to_one":false,"dedicated_post_identity_layer":true,"entity_presence_proves_availability":false,"generic_source_provenance_append":false,"ha_absence_reduces_hioc_confidence":false,"isolation":"HA_ASSOCIATION_ONLY_NOT_DHCP_NUT_INVENTORY_MANUFACTURER_MQTT","no_changes":["last_seen","reachable","online_offline","observation_status","monitoring_policy","health_score","health_status","availability_incidents"],"weak_ip_promotion":false},"observed_compatibility":"COMPATIBLE_UPDATED","observed_ha_core_version":"2026.9.4","prior_binding":{"conflict":"REJECT_PRIOR_BINDING_CONFLICT","retain_previous_known_good":true,"reverse_cardinality_conflict":"REJECT_PRIOR_BINDING_CONFLICT","review_required":true,"silent_move":false},"private_prohibited_fields":["mac","ip","hostname","unique_id","serial_number","configuration_url","config_entry_title","raw_registry_records","raw_response_bodies","unknown_fields","unknown_namespace_values","arbitrary_identifier_values","arbitrary_connection_values","credentials"],"private_retention_allowlist":["hioc_device_id","instance_reference","ha_device_id","association_basis","status","first_associated_at","last_confirmed_at","observed_ha_version","contract_version","ha_metadata","entities","config_entries","area_candidate","relationship_status"],"private_state_path":"state/inventory/associations/home_assistant.json","production_observation":{"counts_are_snapshot_only":true,"date":"2026-10-06","device_recognized_fields_present_all_records":"OBSERVATION_ONLY_NOT_FUTURE_GUARANTEE","registries":{"area_registry":{"counts":{"total":22},"recognized_fields_types":{"aliases":["array"],"area_id":["string"],"created_at":["number"],"floor_id":["null"],"humidity_entity_id":["null"],"icon":["null","string"],"labels":["array"],"modified_at":["number"],"name":["string"],"picture":["null"],"temperature_entity_id":["null"]}},"config_entry_registry":{"counts":{"disabled":1,"total":97,"unknown_field_occurrences":97},"recognized_fields_types":{"created_at":["number"],"disabled_by":["null","string"],"domain":["string"],"entry_id":["string"],"error_reason_translation_key":["null"],"error_reason_translation_placeholders":["null"],"modified_at":["number"],"num_subentries":["integer"],"pref_disable_new_entities":["boolean"],"pref_disable_polling":["boolean"],"reason":["null"],"source":["string"],"state":["string"],"supported_subentry_types":["object"],"supports_options":["boolean"],"supports_reconfigure":["boolean"],"supports_remove_device":["boolean"],"supports_unload":["boolean"],"title":["string"]}},"device_registry":{"counts":{"connection_collision_values":11,"connections_multiple":6,"connections_one":57,"connections_zero":166,"disabled":2,"identifier_collision_values":0,"mac_canonical":54,"mac_collision_values":9,"mac_conflicting_devices":18,"mac_duplicate_entries":0,"mac_entries":62,"mac_invalid":8,"mac_multiple":2,"mac_normalization_required":0,"mac_one":58,"mac_zero":169,"total":229,"unknown_field_occurrences":229,"unpublished_namespace_occurrences":177,"via_device":19,"with_area":58,"with_config_entry":229},"recognized_fields_types":{"area_id":["null","string"],"config_entries":["array"],"config_entries_subentries":["object"],"config_entry_id":["string"],"config_subentry_id":["null","string"],"configuration_url":["null","string"],"connections":["array"],"created_at":["number"],"disabled_by":["null","string"],"entry_type":["null","string"],"hw_version":["null","string"],"id":["string"],"identifiers":["array"],"labels":["array"],"manufacturer":["null","string"],"model":["null","string"],"model_id":["null","string"],"modified_at":["number"],"name":["null","string"],"name_by_user":["null","string"],"primary_config_entry":["string"],"serial_number":["null","string"],"sw_version":["null","string"],"via_device_id":["null","string"]}},"entity_registry":{"counts":{"automation_domain":61,"disabled":1042,"group_domain":0,"scene_domain":5,"template_platform":52,"total":2425,"with_area":1,"with_config_entry":2291,"with_device":2241,"without_device":184},"recognized_fields_types":{"area_id":["null","string"],"categories":["object"],"config_entry_id":["null","string"],"config_subentry_id":["null","string"],"created_at":["number"],"device_id":["null","string"],"disabled_by":["null","string"],"entity_category":["null","string"],"entity_id":["string"],"has_entity_name":["boolean"],"hidden_by":["null","string"],"icon":["null","string"],"id":["string"],"labels":["array"],"modified_at":["number"],"name":["null","string"],"options":["object"],"original_name":["null","string"],"platform":["string"],"translation_key":["null","string"],"unique_id":["string"]}}},"unknown_config_entry_field_observed_type":"null","unknown_field_names":"UNPUBLISHED_NOT_INVENTED"},"prohibited_automatic_matching":["LEVENSHTEIN_STRING_SIMILARITY","SUBSTRING_NAME_MATCHING","MANUFACTURER_MODEL_SCORING","AREA_SCORING","ENTITY_COUNT_SCORING","INTEGRATION_DOMAIN_SCORING","WEIGHTED_CONFIDENCE_PERCENTAGES","IP_ONLY","HOSTNAME_ONLY","FRIENDLY_NAME","ENTITY_ID","UNIQUE_ID","SERIAL_NUMBER","CONFIGURATION_URL","INTEGRATION_IDENTIFIERS"],"public_prohibited_fields":["raw_ha_mac","ha_device_id","entity_registry_id","entity_id","unique_id","config_entry_id","device_name","area_name","config_entry_title","serial_number","configuration_url","arbitrary_identifier_values","arbitrary_connection_values","private_relationship_values"],"public_projection_allowlist":["associated","association_basis","entity_count","integration_domains","has_area_candidate"],"record_type":"PE4_0C_ASSOCIATION_CONTRACT","runtime_adapter":"NOT_IMPLEMENTED","schema_evolution":{"additive_fields":"TOLERATE_ONLY_IF_REQUIRED_FIELDS_AND_TYPES_COMPATIBLE","observed_presence":"SNAPSHOT_ONLY_NOT_UNIVERSAL_REQUIRED_FIELDS","required_break":"FAIL_CLOSED_HA_ASSOCIATION_SUBSYSTEM","universal_future_ha_compatibility":false,"unknown_fields":"NOT_CONSUMED_NOT_RETAINED_NOT_IDENTITY_COUNT_O